Date of Application,Legal Name,Trade Name 2,App NO,Registration Number,Type of PIBO,Application Status
2022-04-05T16:31:15,KAMELIA BEVERAGES,KAMELIA BEVERAGES,67,202204050667,Brand Owner,Rejected
2022-09-02T13:30:26,Everest Polymers,Everest Polymers,166,2022090206166,Brand Owner,Rejected
2022-04-22T16:40:59,Ikayu Foodslabs pvt ltd,Ikayu Foodslabs pvt ltd,300,2022042206300,Brand Owner,Rejected
2022-04-29T15:49:20,BE BETTER PERSONAL CARE PRIVATE LIMITED,BE BETTER PERSONAL CARE PRIVATE LIMITED,417,2022042906417,Brand Owner,Rejected
2022-04-28T12:37:20,SAPREM FOOD PROCESSORS PRIVATE LIMITED,SAPREM FOOD PROCESSORS PRIVATE LIMITED,390,2022042806390,Brand Owner,Rejected
2022-05-04T14:58:40,Petronas Lubricants (India) Private Limited,Petronas Lubricants (India) Private Limited,487,2022050406487,Brand Owner,Rejected
2022-05-06T15:57:05,INDORAMA INDIA PRIVATE LIMITED,INDORAMA INDIA PRIVATE LIMITED,543,2022050606543,Brand Owner,Rejected
2022-05-07T16:04:09,Windlas Biotech Limited   Plant2,Windlas Biotech Limited   Plant2,569,2022050706569,Brand Owner,Rejected
2022-05-11T15:17:46,VRS Foods Limited Unit 4,VRS Foods Limited Unit 4,632,2022051106632,Brand Owner,Rejected
2022-06-01T11:17:58,TRDP Happy World Pvt Ltd,TRDP Happy World Pvt Ltd,1018,20220601061018,Brand Owner,Rejected
2022-07-11T10:09:15,Trident Ltd,Trident Ltd,1458,20220711061458,Brand Owner,Rejected
2022-08-13T16:34:55,Groupe SEB India Private Limited,Groupe SEB India Private Limited,4395,20220813064395,Brand Owner,Rejected
2022-05-20T12:26:12,Saurashtra Cement Limited,Saurashtra Cement Limited,741,2022052006741,Brand Owner,Rejected
2022-08-29T17:13:29,FINO FOOS PRIVATE LIMITED,FINO FOOS PRIVATE LIMITED,1413,20220829061413,Brand Owner,Rejected
2022-05-24T15:56:46,Wonder Packagings,Wonder Packagings,829,2022052406829,Brand Owner,Rejected
2022-06-15T11:26:33,MAXSUN POLYSHRINK PRIVATE LIMITED,MAXSUN POLYSHRINK PRIVATE LIMITED,1420,20220615061420,Brand Owner,Rejected
2022-06-24T13:57:58,Rama Phosphates Limited,Rama Phosphates Limited,1362,20220624061362,Brand Owner,Rejected
2022-06-28T15:11:54,KGN ENTERPRISES,KGN ENTERPRISES,2076,20220628062076,Brand Owner,Rejected
2022-06-15T12:35:33,SONI POLYMERS PRIVATE LIMITED,SONI POLYMERS PRIVATE LIMITED,1513,20220615061513,Brand Owner,Rejected
2022-07-25T18:41:29,MOUNT KAILASH PROCESSED FOODS PRIVATE LIMITED,MOUNT KAILASH PROCESSED FOODS PRIVATE LIMITED,1589,20220725061589,Brand Owner,Rejected
2022-07-11T15:25:51,Panasonic India Pvt Ltd,Panasonic India Pvt Ltd,1632,20220711061632,Brand Owner,Rejected
2022-06-14T18:44:57,S P NATURAL WATER CO,S P NATURAL WATER CO,1656,20220614061656,Brand Owner,Rejected
2022-06-18T16:36:50,VS INDUSTRIES,VS INDUSTRIES,1768,20220618061768,Brand Owner,Rejected
2022-07-12T17:42:33,SOSYO HAJOORI BEVERAGES PRIVATE LIMITED,SOSYO HAJOORI BEVERAGES PRIVATE LIMITED,2633,20220712062633,Brand Owner,Rejected
2022-08-27T11:43:51,Dima Products,Dima Products,4899,20220827064899,Brand Owner,Rejected
2022-08-23T12:10:20,West Assam Milk Producers Co-Operative Union Ltd.,West Assam Milk Producers Co-Operative Union Ltd.,2315,20220823062315,Brand Owner,Rejected
2022-07-26T18:22:02,MEHJAL ADHESIVE TAPES PVT. LTD.,MEHJAL ADHESIVE TAPES PVT. LTD.,2996,20220726062996,Brand Owner,Rejected
2022-07-16T16:43:44,ABHISHEK DISTRIBUTORS PRIVATE LIMITED,M/S NB ICE CREAM ( A UNIT OF ABHISHEK),2819,20220716062819,Brand Owner,Rejected
2022-07-29T15:24:03,Kelzai Secrets Private Limited,Kelzai Secrets Private Limited,3180,20220729063180,Brand Owner,Rejected
2022-07-29T11:22:14,Vital Home Care,Vital Home Care,3372,20220729063372,Brand Owner,Rejected
2022-07-29T19:17:32,SPG BEVERAGES,Rumi,3408,20220729063408,Brand Owner,Rejected
2022-08-05T16:25:32,SOYABEAN PRODUCT,SOYABEAN PRODUCT,6698,20220805066698,Brand Owner,Rejected
2022-08-06T16:29:00,TESLA FOODS PVT LTD,TESLA FOODS PVT LTD,4235,20220806064235,Brand Owner,Rejected
2022-08-17T12:11:21,SIGNATURE OVERSEAS,SIGNATURE OVERSEAS,4605,20220817064605,Brand Owner,Rejected
2022-08-20T18:46:50,Bigfoot Retail Solutions Private Limited,Shiprocket,4811,20220820064811,Brand Owner,Rejected
2022-08-24T10:43:35,Indapur Dairy And Milk Products Limited,Indapur Dairy And Milk Products Limited,4833,20220824064833,Brand Owner,Rejected
2022-09-01T11:42:54,PLASCOM INDUSTRIES LLP,PLASCOM INDUSTRIES LLP,5095,20220901065095,Brand Owner,Rejected
2022-08-30T12:58:00,FRIGORIFICO ALLANA PRIVATE LIMITED,FRIGORIFICO ALLANA PRIVATE LIMITED,5155,20220830065155,Brand Owner,Rejected
2022-08-31T11:56:45,MSPL,MSPL,6910,20220831066910,Brand Owner,Rejected
2022-09-07T11:01:31,TARREY UDYOG,TARREY UDYOG,5543,20220907065543,Brand Owner,Rejected
2022-09-08T12:16:18,Indorama India Private Limited Jagdishpur,Indorama India Private Limited Jagdishpur,5599,20220908065599,Brand Owner,Rejected
2022-09-13T19:58:11,Brand Owner,Brand Owner,6995,20220913066995,Brand Owner,Rejected
2022-09-14T13:13:02,TUTUL SARKAR,TUTUL SARKAR,7041,20220914067041,Brand Owner,Rejected
2022-09-14T13:51:24,PRADEEP KUMAR TRILOKCHAND,PRADEEP KUMAR TRILOKCHAND,7050,20220914067050,Brand Owner,Rejected
2022-09-15T14:44:42,NANDINI AGRO,M/s NANDINI AGRO,7177,20220915067177,Brand Owner,Rejected
2022-09-16T11:33:04,NORTHERN INDIA TRADING COMPANY,NORTHERN INDIA TRADING COMPANY,7241,20220916067241,Brand Owner,Rejected
2022-09-16T13:22:14,NORTH EAST NUTRIENTS PRIVATE LIMITED,NORTH EAST NUTRIENTS PRIVATE LIMITED,7261,20220916067261,Brand Owner,Rejected
2022-09-27T13:41:13,Shubham Textiles,Shubham Textiles,544800475,2022092706544800475,Brand Owner,Rejected
2022-09-28T14:25:59,Labhchand Dudhoria,Shri Balaji Synthetic,544800528,2022092806544800528,Brand Owner,Rejected
2022-10-05T15:26:05,K P Textiles Private Limited,K P Textiles Private Limited,544800816,2022100506544800816,Brand Owner,Rejected
2022-10-07T11:43:37,SFC FOODS PVT LTD,SFC FOODS PVT LTD,544800869,2022100706544800869,Brand Owner,Rejected
2022-10-07T12:19:45,WELL FRAGRANCES PRIVATE LIMITED,WELL FRAGRANCES PRIVATE LIMITED,544800875,2022100706544800875,Brand Owner,Rejected
2022-10-10T16:16:59,AALISHAN INTERNATIONAL PVT. LTD,AALISHAN INTERNATIONAL PVT. LTD,544800970,2022101006544800970,Brand Owner,Rejected
2022-10-12T15:08:12,MIREK THERMOFORMERS PRIVATE LIMITED,MIREK THERMOFORMERS PRIVATE LIMITED,544801093,2022101206544801093,Brand Owner,Rejected
2022-10-17T12:16:22,KALORY FOODS PRIVATE LIMITED,KALORY FOODS PRIVATE LIMITED,544801322,2022101706544801322,Brand Owner,Rejected
2022-10-26T14:21:22,RALA FOOD SPECIALITIES,SWASTIK MASALAS FOOD,544801655,2022102606544801655,Brand Owner,Rejected
2022-11-03T18:27:01,Press Fit Pipe and Profile,Press Fit Pipe and Profile,544801991,2022110306544801991,Brand Owner,Rejected
2022-11-08T15:05:00,Shri Padhmam Industries,Shri Padhmam Industries,544802186,2022110806544802186,Brand Owner,Rejected
2022-11-10T17:50:52,DEMPO DAIRY INDUSTRIES LIMITED,DEMPO DAIRY INDUSTRIES LIMITED,544802340,2022111006544802340,Brand Owner,Rejected
2022-11-14T19:53:31,SRI VYSHNAVI DAIRY SPECIALITIES PRIVATE LIMITED,SRI VYSHNAVI DAIRY SPECIALITIES PRIVATE LIMITED,544802513,2022111406544802513,Brand Owner,Rejected
2022-11-15T16:03:55,JAI POLYMERS,JAI POLYMERS,544802561,2022111506544802561,Brand Owner,Rejected
2022-11-17T11:07:33,7-INDIA CONVENIENCE RETAIL LIMITED,7-INDIA CONVENIENCE RETAIL LIMITED,544802662,2022111706544802662,Brand Owner,Rejected
2022-12-07T11:48:34,VIN CORPORATION,VIN CORPORATION,544803232,2022120706544803232,Brand Owner,Rejected
2022-12-07T15:01:05,RELAXO FOOTWEARS LIMITED,Relaxo Footwears Limited,544803255,2022120706544803255,Brand Owner,Rejected
2022-12-08T10:30:05,VIN ENTERPRISES,VIN ENTERPRISES,544803289,2022120806544803289,Brand Owner,Rejected
2022-12-08T10:46:50,RAJAN GANDHI,R P AUTOSTYLES,544803290,2022120806544803290,Brand Owner,Rejected
2022-12-09T17:12:52,Y S CORPORATION,Y S CORPORATION,544803389,2022120906544803389,Brand Owner,Rejected
2022-12-09T20:49:14,Kennametal India Limited,Kennametal India Limited,544803397,2022120906544803397,Brand Owner,Rejected
2022-12-15T10:26:47,BIO-MED HEALTH CARE PRODUCTS PRIVATE LIMITED,M/S BIO-MED HEALTHCARE PRODUCTS PVT LTD,544803631,2022121506544803631,Brand Owner,Rejected
2022-12-17T12:23:40,CSH POWER HIMOINSA PRIVATE LIMITED,CSH POWER HIMOINSA PVT LTD,544803745,2022121706544803745,Brand Owner,Rejected
2022-12-20T18:24:11,R V S CONVENTIONS PVT LIMITED,R V S CONVENTIONS PVT LTD,544803982,2022122006544803982,Brand Owner,Rejected
2023-01-10T13:24:24,RADHARANI POLYMERS PRIVATE LIMITED,Radharani Polymers Pvt Ltd,544805139,2023011006544805139,Brand Owner,Rejected
2023-01-12T15:08:46,TOKAI RIKA MINDA INDIA PRIVATE LIMITED,Tokai Rika Minda India Pvt Ltd,544805267,2023011206544805267,Brand Owner,Rejected
2023-01-13T11:32:10,ULTRATECH CEMENT LIMITED,UltraTech Cement,544805325,2023011306544805325,Brand Owner,Rejected
2023-01-14T17:38:21,R S FOODS,R S FOODS,544805437,2023011406544805437,Brand Owner,Rejected
2023-01-18T12:37:05,PIONEER INTERNATIONAL,PIONEER INTERNATIONAL,544805611,2023011806544805611,Brand Owner,Rejected
2023-01-20T16:03:24,REGENT LIGHTING ASIA PRIVATE LIMITED,REGENT LIGHTING ASIA PRIVATE LIMITED,544805880,2023012006544805880,Brand Owner,Rejected
2023-01-21T14:34:19,AMANTA HEALTHCARE LIMITED,Amanta Healthcare PVT limited,544805826,2023012106544805826,Brand Owner,Rejected
2023-01-23T16:27:26,AMPACET SPECIALITY PRODUCTS PRIVATE LIMITED,Ampacet Speciality Products Pvt Ltd,544805912,2023012306544805912,Brand Owner,Rejected
2023-01-24T23:57:54,SAGAR INDUSTRIES,AWADHESH KUMAR,544806010,2023012406544806010,Brand Owner,Rejected
2023-01-29T15:28:02,M/s Chettinad Cement Corporation Private Limited,M/s Chettinad Cement Corporation Private Limited,544806192,2023012906544806192,Brand Owner,Rejected
2023-02-11T20:27:18,VHV BEVEREAGES PRIVATE LIMITED,VHV BEVEREAGES PRIVATE LIMITED,544807013,2023021106544807013,Brand Owner,Rejected
2023-02-14T18:25:46,UNITED ENTERPRISES,UE BIO BAG,544823890,2023021406544823890,Brand Owner,Rejected
2023-02-25T13:40:20,KESHAV INDUSTRIES PRIVATE LIMITED,KESHAV INDUSTRIES PVT LTD,544809195,2023022506544809195,Brand Owner,Rejected
2023-03-03T16:57:11,L,LUX FLAVOURS,544810743,2023030306544810743,Brand Owner,Rejected
2023-03-04T09:31:43,AVALON COSMETICS PRIVATE LIMITED,Avalon Cosmetics Private Limited,544810744,2023030406544810744,Brand Owner,Rejected
2023-03-07T18:27:00,AVON BEAUTY PRODUCTS INDIA PRIVATE LIMITED,Avon,544812301,2023030706544812301,Brand Owner,Rejected
2023-03-08T10:28:49,GKB VISION PRIVATE LIMITED,GKB VISION PVT LTD,544811348,2023030806544811348,Brand Owner,Rejected
2023-03-22T13:15:18,HINDUSTAN FOODS LIMITED,Hindustan Foods Ltd.,544814823,2023032206544814823,Brand Owner,Rejected
2023-03-22T15:19:41,DODLA DAIRY LIMITED,DODLA DAIRY LIMITED,544814892,2023032206544814892,Brand Owner,Rejected
2023-03-24T11:30:15,MARAM POLYMERS LIMITED,MARAM POLYMERS LIMITED,544815340,2023032406544815340,Brand Owner,Rejected
2023-03-27T17:29:28,M,M/S GAURAV AGRO PIPES,544816174,2023032706544816174,Brand Owner,Rejected
2023-03-30T14:12:42,D.J.S. PRINTERS PRIVATE LIMITED,D.J.S. PRINTERS PRIVATE LIMITED.,544817001,2023033006544817001,Brand Owner,Rejected
2023-04-04T16:41:34,Prism Johnson Ltd.(Cement Division),PRISM JOHNSON LIMITED,544818139,2023040406544818139,Brand Owner,Rejected
2023-04-11T11:15:09,JABIL CIRCUIT INDIA PRIVATE LIMITED,JABIL CIRCUIT INDIA PRIVATE LIMITED,544819307,2023041106544819307,Brand Owner,Rejected
2023-04-11T16:43:36,MARUTI ROPES INDIA PRIVATE LIMITED,MARUTI ROPES INDIA PRIVATE LIMITED,544819450,2023041106544819450,Brand Owner,Rejected
2023-04-11T16:48:55,MARUTI TECHNOFAB INDUSTRIES PRIVATE LIMITED,MARUTI TECHNOFAB INDUSTRIES PRIVATE LIMITED,544819454,2023041106544819454,Brand Owner,Rejected
2023-04-13T15:13:23,SS Coatings,SS Coatings,544820082,2023041306544820082,Brand Owner,Rejected
2023-04-15T11:41:56,V K PACKWELL PRIVATE LIMITED,V. K. PACKWELL PRIVATE LIMITED,544820456,2023041506544820456,Brand Owner,Rejected
2023-04-15T12:28:38,SREE MURALI MOHANA BOILED AND RAW RICE MILL PRIVATE LIMITED,SREE MURALI MOHANA BOILED AND RAW RICE MILL PRIVATE LIMITED,544820489,2023041506544820489,Brand Owner,Rejected
2023-04-15T15:33:54,GUJARAT POLY ELECTRONICS LIMITED,GUJARAT POLY ELECTRONICS LIMITED,544820582,2023041506544820582,Brand Owner,Rejected
2023-05-18T12:23:48,M/s   VALAGRO BIOSCIENCES PRIVATE LIMITED,VALAGRO BIOSCIENCES PRIVATE LIMITED,544827288,2023051806544827288,Brand Owner,Rejected
2023-05-22T11:44:33,M/s   LAURUS LABS LIMITED,LAURUS LABS LIMITED,544827921,2023052206544827921,Brand Owner,Rejected
2023-05-24T12:32:27,M/s   BEETEL TELETECH LIMITED,BEETEL TELETECH LIMITED,544828374,2023052406544828374,Brand Owner,Rejected
2023-06-01T15:22:40,M/s   SYMBIOTEC PHARMALAB PVT LTD,SYMBIOTEC PHARMALAB PVT LTD,544829817,2023060106544829817,Brand Owner,Rejected
2023-06-09T17:41:31,M/s   POWER CHEM PLAST LIMITED,POWER CHEM PLAST LIMITED,544831104,2023060906544831104,Brand Owner,Rejected
2023-06-12T12:13:35,M/s   AXIOM DISTRIBUTION,Axiom Distribution,544831333,2023061206544831333,Brand Owner,Rejected
2023-06-13T18:52:06,M/s   EASTMAN NEW ENERGY PRIVATE LIMITED,EASTMAN NEW ENERGY PRIVATE LIMITED,544831714,2023061306544831714,Brand Owner,Rejected
2023-06-27T15:53:54,M/s   BETUL OIL LIMITED,BETUL OIL LIMITED,544833626,2023062706544833626,Brand Owner,Rejected
2023-06-28T12:49:12,M/s   TAMILNADU SUGAR CORPORATION LIMITED,TAMILNADU SUGAR CORPORATION LIMITED,544834084,2023062806544834084,Brand Owner,Rejected
2023-06-28T16:18:40,M/s   THE CHEYYAR CO-OPERATIVE SUGAR MILLS LTD.,SUGAR,544833865,2023062806544833865,Brand Owner,Rejected
2023-06-30T20:54:00,M/s   SHRI LAKSHMI AGRO FOODS PRIVATE LIMITED,SHRI LAKSHMI AGRO FOODS PRIVATE LIMITED,544834250,2023063006544834250,Brand Owner,Rejected
2023-07-17T17:11:29,M/s   BDA HEALTH CARE PRIVATE LIMITED,BDA HEALTH CARE PRIVATE LIMITED,544836535,2023071706544836535,Brand Owner,Rejected
2023-07-20T15:08:49,M/s   SPAN SEATING SYSTEMS PRIVATE LIMITED,SPAN SEATING SYSTEMS PRIVATE LIMITED,544837051,2023072006544837051,Brand Owner,Rejected
2023-07-28T14:30:00,M/s   SHRIRANG KISANLAL SARDA,Sarda Farms,544837845,2023072806544837845,Brand Owner,Rejected
2023-08-14T10:28:16,Shri  SHYAM PRAKASH,ESS GEE INDUSTRIES,544839837,2023081406544839837,Brand Owner,Rejected
2023-08-16T11:50:16,M/s   FORCE MTU POWER SYSTEMS PRIVATE LIMITED,FORCE MTU POWER SYSTEMS PRIVATE LIMITED,544840036,2023081606544840036,Brand Owner,Rejected
2023-08-16T13:34:14,M/s   GOODLUCK INDIA LIMITED,GOODLUCK INDIA LIMITED,544840440,2023081606544840440,Brand Owner,Rejected
2023-08-24T11:59:26,Shri  BASANT PURI,PROGRESSIVE FOOD AND CHEMICAL INDUSTRY,544841105,2023082406544841105,Brand Owner,Rejected
2023-08-28T11:13:54,M/s   BRIDGESTONE INDIA PRIVATE LIMITED,BRIDGESTONE INDIA PRIVATE LIMITED,544841471,2023082806544841471,Brand Owner,Rejected
2023-09-19T12:25:55,M/s   L G BALAKRISHNAN & BROS LTD,L G BALAKRISHNAN & BROS LIMITED,544843513,2023091906544843513,Brand Owner,Rejected
2023-09-29T16:13:03,M/s   BHARTI HEXACOM LIMITED,BHARTI HEXACOM LIMITED,544844352,2023092906544844352,Brand Owner,Rejected
2023-10-04T17:49:35,M/s   BHARTI AIRTEL SERVICES LIMITED,BHARTI AIRTEL SERVICES LIMITED,544845006,2023100406544845006,Brand Owner,Rejected
2023-10-07T09:24:37,M/s   DEVI FISHERIES  LIMITED,DEVI FISHERIES LIMITED,544844825,2023100706544844825,Brand Owner,Rejected
2023-10-07T11:31:45,M/s   GANDHAR OIL REFINERY (INDIA) LIMITED,GANDHAR OIL REFINERY (INDIA) LIMITED,544844851,2023100706544844851,Brand Owner,Rejected
2023-10-07T12:04:48,M/s   UTTARI RAJASTHAN SAHAKARI DUGDH UTPADAK SANGH LIMITED,UTTARI RAJASTHAN SAHAKARI DUGDH UTPADAK SANGH LIMITED,544844875,2023100706544844875,Brand Owner,Rejected
2023-10-07T17:16:43,M/s   WELEX LABORATORIES PRIVATE LIMITED,WELEX LABORATORIES PRIVATE LIMITED,544844934,2023100706544844934,Brand Owner,Rejected
2023-10-11T11:41:12,M/s   SOFIMA FILTERS INDIA PRIVATE LIMITED,SOFIMA FILTERS INDIA PRIVATE LIMITED,544845178,2023101106544845178,Brand Owner,Rejected
2023-10-12T16:47:11,M/s   BHARTI AIRTEL LIMITED,BHARTI AIRTEL LIMITED,544845378,2023101206544845378,Brand Owner,Rejected
2023-10-19T16:15:29,Shri PARMANAND AMAR KHATRI,Amar dairy,544845906,2023101906544845906,Brand Owner,Rejected
2023-10-20T12:43:12,M/s   HITACHI ASTEMO HARYANA PRIVATE LIMITED,HITACHI ASTEMO HARYANA PRIVATE LIMITED,544847124,2023102006544847124,Brand Owner,Rejected
2023-10-20T15:26:43,M/s   SHILPA PHARMA LIFESCIENCES LIMITED,SHILPA PHARMA LIFESCIENCES LIMITED,544845979,2023102006544845979,Brand Owner,Rejected
2023-10-25T15:35:53,Shri  RANJIT SARMAH,CG Food,544846260,2023102506544846260,Brand Owner,Rejected
2023-10-26T10:24:17,M/s   MICRO LABS LIMITED,MICRO LABS LIMITED,544846315,2023102606544846315,Brand Owner,Rejected
2023-11-09T19:04:48,M/s   DAVE MASALA PRIVATE LIMITED,DAVE MASALA PRIVATE LIMITED,544847741,2023110906544847741,Brand Owner,Rejected
2023-11-10T11:47:48,M/s   SHRIRAM AGSMART LIMITED,SHRIRAM AGSMART LIMITED,544848260,2023111006544848260,Brand Owner,Rejected
2023-11-27T13:23:53,M/s   SHREE PUSHKAR CHEMICALS AND FERTILISERS LTD,SHREE PUSHKAR CHEMICALS & FERTILISERS LIMITED,544848227,2023112706544848227,Brand Owner,Rejected
2023-11-29T15:04:40,M/s   MULTI ORGANICS PRIVATE LIMITED,MULTI ORGANICS PRIVATE LIMITED,544848271,2023112906544848271,Brand Owner,Rejected
2023-12-12T18:03:16,M/s   SFC SOLUTIONS INDIA (SEALING) PRIVATE LIMITED,SFC SOLUTIONS INDIA (SEALING) PRIVATE LIMITED,544849537,2023121206544849537,Brand Owner,Rejected
2023-12-14T13:20:35,M/s   WIPRO ENTERPRISES PRIVATE LIMITED,WIPRO ENTERPRISES PRIVATE LIMITED,544849675,2023121406544849675,Brand Owner,Rejected
2023-12-16T13:35:03,Shri LAXMAN ROHAN TEKCHANDANI,GREEN LAXMI FOODS,544849853,2023121606544849853,Brand Owner,Rejected
2023-12-20T14:50:00,M/s   PRICOL LIMITED,PRICOL LIMITED,544850102,2023122006544850102,Brand Owner,Rejected
2023-12-23T14:59:51,Shri MOHAMMAD GH KHAN,MS GM KHAN,544850334,2023122306544850334,Brand Owner,Rejected
2024-01-04T11:09:15,M/s   WAVE BEVERAGES PRIVATE LIMITED,WAVE BEVERAGES PRIVATE LIMITED,544850980,2024010406544850980,Brand Owner,Rejected
2024-01-11T16:42:25,M/s   AGRI-SEARCH INDIA PRIVATE LIMITED,M/s AGRI SEARCH (INDIA) PRIVATE LIMITED,544851466,2024011106544851466,Brand Owner,Rejected
2024-03-15T11:25:48,M/s   PROSPERITY 6 PHARMACEUTICS,PROSPERITY 6 PHARMACEUTICS,544853035,2024031506544853035,Brand Owner,Rejected
2024-03-15T12:08:11,M/s   PROSPERITY 6 PHARMACEUTICS,PROSPERITY 6 PHARMACEUTICS,544853069,2024031506544853069,Brand Owner,Rejected
2024-04-27T15:04:12,M D INDUSTRIES,M D INDUSTRIES,544853999,2024042706544853999,Brand Owner,Rejected
2024-04-30T20:43:12,M/s   SRI NARASUS COFFEE COMPANY PRIVATE LIMITED,SRI NARASUS COFFEE COMPANY PRIVATE LIMITED,544854225,2024043006544854225,Brand Owner,Rejected
2024-05-04T12:34:32,M/s   TENNECO AUTOMOTIVE INDIA PVT LTD,TENNECO AUTOMOTIVE INDIA PRIVATE LIMITED,544854495,2024050406544854495,Brand Owner,Rejected
2024-05-29T15:08:31,SHRI HANUMAN SAHAKARI DUD H VYAVSAIK AND  KRUSHIPURAK SEVA SANSTHA,SHRI HANUMAN SAH DUDHVYA VA K S S LTD,544855197,2024052906544855197,Brand Owner,Rejected
2024-06-03T08:25:02,roots multiclean ltd,ROOTS MULTI CLEAN LIMITED,544855639,2024060306544855639,Brand Owner,Rejected
2024-06-04T10:40:21,pyrotech electronics private limited,PYROTECH ELECTRONICS PVT. LTD.,544855871,2024060406544855871,Brand Owner,Rejected
2024-06-05T15:24:34,ichibanya india private limited,ICHIBANYA INDIA PRIVATE LIMITED,544856427,2024060506544856427,Brand Owner,Rejected
2024-06-07T15:02:55,minda nabtesco automotive private limited,MINDA NABTESCO AUTOMOTIVE PRIVATE LIMITED,544856507,2024060706544856507,Brand Owner,Rejected
2024-06-11T15:12:15,DARAMIC BATTERY SEPARATOR INDIA PRIVATE LIMITED,DARAMIC BATTERY SEPARATOR INDIA PRIVATE LIMITED,544856828,2024061106544856828,Brand Owner,Rejected
2024-06-14T10:56:23,forech india private limited,FORECH INDIA PRIVATE LIMITED,544857086,2024061406544857086,Brand Owner,Rejected
2024-06-14T11:55:56,reliance consumer products limited,RELIANCE CONSUMER PRODUCTS LIMITED,544857112,2024061406544857112,Brand Owner,Rejected
2024-06-19T16:44:07,og beauty private limited,OG BEAUTY PRIVATE LIMITED,544857493,2024061906544857493,Brand Owner,Rejected
2024-06-29T13:07:02,abhideep chemicals private limited,ABHIDEEP CHEMICALS PVT LTD,544858173,2024062906544858173,Brand Owner,Rejected
2024-07-10T17:35:23,vocon manufacturing private limited,VOCON MANUFACTURING PRIVATE LIMITED,544858985,2024071006544858985,Brand Owner,Rejected
2024-07-12T17:37:30,jalnidhi bitumen specialities private limited,JALNIDHI BITUMEN SPECIALITIES PVT LTD,544859124,2024071206544859124,Brand Owner,Rejected
2024-07-25T13:41:20,colortex,colortex,544859789,2024072506544859789,Brand Owner,Rejected
2024-07-25T15:28:37,suneel auto comp pvt ltd,SUNEEL AUTO COMP PRIVATE LIMITED,544859798,2024072506544859798,Brand Owner,Rejected
2024-07-25T15:49:15,avn ayurveda formulations private limited,AVN AYURVEDA FORMULATIONS PRIVATE LIMITED,544859802,2024072506544859802,Brand Owner,Rejected
2024-07-26T11:21:14,itc fibre innovations limited,ITC FIBRE INNOVATIONS LIMITED,544859830,2024072606544859830,Brand Owner,Rejected
2024-08-05T11:54:50,madura polymers,MADURA POLYMERS,544860343,2024080506544860343,Brand Owner,Rejected
2024-08-07T16:53:58,jaya and company,JAYA AND COMPANY,544860507,2024080706544860507,Brand Owner,Rejected
